{
  "findings": [],
  "format_version": "2.0.0",
  "review_id": "W05-v2-QR-semantics-950a69b3",
  "review_kind": "semantics",
  "reviewer": "external-read-only-semantics-review",
  "status": "pass",
  "subject_commit": "950a69b384ad82bc7792c0f8654753a3e32b7d18",
  "subject_tree": "37fe0c0dfb4d47d612a107e47c00b45416151c69"
}
